{
  "node_id": "review:panel_s21_a01_cc",
  "node_type": "review",
  "status": "complete",
  "title": "CC narrative review S21 panel a1",
  "created_at": "2026-06-08T00:00:00+00:00",
  "payload": {
    "target_node_id": "attempt:s21_a01",
    "reviewer": "cc",
    "gate_kind": "panel",
    "narrative_beat_fidelity": 5,
    "composition_story": 4,
    "timed_out": false,
    "notes": "S21 fully delivers its B12 beat: the homecoming exchange (我回来了/欢迎回来/去睡吧) closes the family arc, the glass-plane high-five with contact glow lands the executor's mirror 'smallest bounce' (restrained pose, caption carries th"
  }
}
