{
  "node_id": "decision:panel_s22_a01",
  "node_type": "decision",
  "status": "final",
  "title": "panel_gate S22 a1 → retry_panel",
  "created_at": "2026-06-08T00:00:00+00:00",
  "payload": {
    "gate_kind": "panel",
    "target_node_id": "attempt:s22_a01",
    "verdict": "retry_panel",
    "reasoning": "a visual reviewer returned incomplete core scores (fail-closed)",
    "repair_instruction": ""
  }
}
