{
  "node_id": "review:panel_s13_a01_gemini",
  "node_type": "review",
  "status": "complete",
  "title": "Gemini visual review S13 panel a1",
  "created_at": "2026-06-08T00:00:00+00:00",
  "payload": {
    "target_node_id": "attempt:s13_a01",
    "reviewer": "gemini",
    "gate_kind": "panel",
    "identity_consistency": 5,
    "style_consistency": 5,
    "composition_readability": 5,
    "artifact_severity": 0,
    "baked_text_quality": 5,
    "content_corruption_present": false,
    "stray_text_present": false,
    "safezone_present": true,
    "timed_out": false,
    "observed_literals": ["+6.2", "+1.4", "+4.8", "json_sanitizer", "jsonschema.validate", "1603", "EVALUATOR INTEGRITY", "sanitizer != external validator", "model output (malformed)"],
    "failure_mode_positive_invariant": "baked-duo 技术对比图渲染干净:双列对照(json_sanitizer vs jsonschema.validate)、核心数字 1603 / +6.2 / +1.4 / +4.8 与标题 EVALUATOR INTEGRITY 全部逐字烤字正确、无拼写偏差、无杂散字形——保持这种低密度双列对照布局 + 充足安全区的烤字方式。",
    "notes": "Gemini auto-gemini-3 VISUAL review of S13_panel_a01.png, mode=baked-duo。双人身份在像素chibi风格下保持稳定:executor(蓝衣+棕发+无须)与reviewer(绿衣+黑发+有须)区分清晰,与 duo_canonical_ref 一致,identity_consistency=5。像素霓虹风格统一、配色与构图层次贴合基调,style_consistency=5。技术对比图可读、视线导向清晰(duo -> 双列分解对照 -> integrity caption),核心数字 1603 / +6.2 / +1.4 / +4.8 与代码字面 json_sanitizer / jsonschema.validate 逐字可读,composition_readability=5。无肢体崩坏/融合伪影,artifact_severity=0。本稿为 baked-duo:baked CJK 气泡与技术图英文(标题 EVALUATOR INTEGRITY 拼写正确、'sanitizer != external validator' caption)烤字清晰高质,baked_text_quality=5,content_corruption_present=false。安全区保留 safezone_present=true;无游离 HTML-冲突字形 stray_text_present=false。正向不变量:双列对照低密度烤字布局应保持。[transcribed from gemini auto-gemini-3 CLI read, RC=0]"
  }
}
