{
  "node_id": "review:panel_s15_a01_gemini",
  "node_type": "review",
  "status": "complete",
  "title": "Gemini visual review S15 panel a1",
  "created_at": "2026-06-08T00:00:00+00:00",
  "payload": {
    "target_node_id": "attempt:s15_a01",
    "reviewer": "gemini",
    "gate_kind": "panel",
    "identity_consistency": 5,
    "style_consistency": 5,
    "composition_readability": 5,
    "artifact_severity": 5,
    "safezone_present": true,
    "stray_text_present": false,
    "failure_mode_positive_invariant": "保持当前角色边缘的硬像素处理与背景大气光效的清晰分层",
    "timed_out": false,
    "notes": "Gemini (auto-gemini-3) visual review of S15_panel_a01.png vs duo_canonical_ref。双人身份（executor 与 reviewer 各自帽衫配色、黑发、reviewer 络腮胡）在像素风格下完全稳定，与 identity_refs 一致，identity_consistency=5。像素霓虹风格统一，深蓝 wiki void 背景与角色边缘的硬像素处理、背景大气光效形成清晰分层，style_consistency=5。构图清晰、视线导向干净，中心到右侧留白可承接 HTML 文字层，composition_readability=5。未见冒出可读文字/伪代码字形（stray_text_present=false），背景与角色边缘干净、无明显噪点或拼接伪影（artifact_severity=5）。已预留干净文字安全区（safezone_present=true）。failure_mode_positive_invariant：保持当前角色边缘的硬像素处理与背景大气光效的清晰分层。视觉层面无需返工——本面板的 retry 触发来自 CC 叙事节拍读数（narrative_beat_fidelity=3），非视觉缺陷。"
  }
}
