{
  "node_id": "review:panel_s11_a01_gemini",
  "node_type": "review",
  "status": "complete",
  "title": "Gemini visual review S11 panel a1",
  "created_at": "2026-06-08T00:00:00+00:00",
  "payload": {
    "target_node_id": "attempt:s11_a01",
    "reviewer": "gemini",
    "gate_kind": "panel",
    "identity_consistency": 5,
    "style_consistency": 5,
    "composition_readability": 5,
    "artifact_severity": 0,
    "baked_text_quality": 5,
    "observed_literals": [
      "2048",
      "exact_parse",
      "{\"city\": \"Tokyo\"}",
      "37",
      "malformed",
      "REJECT",
      "T-16:05",
      "0.66",
      "flat"
    ],
    "content_corruption_present": false,
    "timed_out": false
  }
}
