{
  "node_id": "decision:panel_s15_a04",
  "node_type": "decision",
  "status": "final",
  "title": "panel_gate S15 a4 → keep",
  "created_at": "2026-06-08T00:00:00+00:00",
  "payload": {
    "gate_kind": "panel",
    "target_node_id": "attempt:s15_a04",
    "verdict": "keep",
    "reasoning": "KEEP — narr=4 identity=5 style=5/5 comp=4/5 art(g/c)=0/1 safezone=true stray=false disagreeId=0",
    "repair_instruction": ""
  }
}
