{
  "node_id": "decision:panel_s10_a03",
  "node_type": "decision",
  "status": "final",
  "title": "panel_gate S10 a3 → retry_panel",
  "created_at": "2026-06-08T00:00:00+00:00",
  "payload": {
    "gate_kind": "panel",
    "target_node_id": "attempt:s10_a03",
    "verdict": "retry_panel",
    "reasoning": "RETRY — [baked] narr=4 identity=5 style=5/5 comp=5/5 art(g/c)=0/1 btq=5 corruption=true reviewersOk=true missing(¬both)=[] disagreeId=0",
    "repair_instruction": "身份锁、暗霓虹像素风、构图读序、气泡中文、0.66与ParseError都稳；失败点是中央hero JSON的引号/裂缝位置错位，未干净呈现预期的{\"city\":\"Tok|yo\"}。"
  }
}
