{
  "node_id": "review:panel_s02_a01_cc",
  "node_type": "review",
  "status": "complete",
  "title": "CC narrative review S02 panel a1",
  "created_at": "2026-06-08T00:00:00+00:00",
  "payload": {
    "target_node_id": "attempt:s02_a01",
    "reviewer": "cc",
    "gate_kind": "panel",
    "narrative_beat_fidelity": 5,
    "composition_story": 4,
    "timed_out": false,
    "notes": "B02 hand-off fully delivered: all three baked bubbles match IR text exactly (researcher hand-off / executor \"交给我！\" / reviewer \"我盯着。\" = the no-human-safety-net thesis); all expected literals present ($ aris run + task + deadline flags, green ARIS ONLINE stamp, amber DDL chip T-24:00:00) on the terminal card riding the seam; warm bedroom left (hot ML RESEARCH mug, 'submit / sleep' note) vs dark-cyber right with the executor's highest jump of the film sells the 23:58 hand-off caption. Minor deduction: the seam-riding terminal card slightly crowds the duo's wake-up beat on the right half, composition_story=4."
  }
}
