{
  "node_id": "review:panel_s15_a04_codex",
  "node_type": "review",
  "status": "complete",
  "title": "Codex visual review S15 panel a4",
  "created_at": "2026-06-08T00:00:00+00:00",
  "payload": {
    "target_node_id": "attempt:s15_a04",
    "reviewer": "codex",
    "gate_kind": "panel",
    "identity_consistency": 5,
    "style_consistency": 5,
    "composition_readability": 4,
    "artifact_severity": 1,
    "safezone_present": true,
    "stray_text_present": false,
    "failure_mode_positive_invariant": "双人身份铁律保持：executor蓝衣棕发无须，reviewer绿衣黑发有须；像素chibi与数字wiki背景统一，中央/右侧留白可承接HTML文字层",
    "timed_out": false,
    "notes": "Codex visual reviewer (GPT-5.5 xhigh) independent read of panels/S15_panel_a04.png。双人身份锁定:executor 蓝 hoodie 棕发无须、reviewer 绿 hoodie 黑发有须,与 identity_refs 一致,identity_consistency=5。像素 chibi + 深蓝 wiki void 霓虹配色统一,style_consistency=5。构图可读、视线导向 executor→edge→verdict→reviewer 干净,composition_readability=4。图内无可读文字/伪代码字形(stray_text_present=false),仅极轻微噪点,artifact_severity=1。中央/右侧大面积低细节留白可承接 HTML 气泡(safezone_present=true)。正向不变量:双人身份铁律保持:executor蓝衣棕发无须,reviewer绿衣黑发有须;像素chibi与数字wiki背景统一,中央/右侧留白可承接HTML文字层。"
  }
}
